Cluster_ID;Descricao_Item;Preco_Pago;Preco_Referencia;Teto_Estatistico;Perc_Excesso;ano;unidade_gestora
11;compra de fita adesiva dupla face para uso da ascom na afixacao dos paineis de exposicao na ocasiao do evento de inauguracao do predio da prpb;212.52;33.80;180.00;18.07;2017;
17;servicos de mao de obra remanejamento de 06 ramais com extensao e identificacao de ramais disponiveis no dg;490.00;90.00;415.15;18.03;2016;
18;material de manutencao predial para uso na prpb;270.00;48.00;228.78;18.02;2021;prpb
2;aquisicao de 50 un displays de uso para orientacoes do coronavirus na prr4 portal de pedidos n 19661  ascomprr4;450.00;93.80;381.85;17.85;2020;prr4 regiao
16;contratacao de servicos hidraulicos na prmvarginha tendo em vista a ocorrencias de varios vazamentos;388.33;66.02;330.00;17.68;2019;prmg
1;compra emergencial de cartao de memoria para utilizacao no celular funcional e tripe ambos para a gravacao de audiencia publica;158.00;11.60;134.35;17.60;2019;prsc
12;corrente zb curta 1;218.00;31.00;185.55;17.49;2016;
18;aquisicao de epi p servidores e de materiais para uso em manutencoes na prsc;268.25;48.00;228.78;17.25;2019;prsc
8;"manutencao em sanitarios colagem de pisos e substituicao de lampadas queimadas no predio da prsc
 o item solvente e flanela foi solicitado pela cojud";291.30;50.00;248.54;17.20;2018;
14;cavalete de sinalizacao para as vagas externas de estacionamento;451.00;69.98;384.90;17.17;2018;
13;aquisicao de baterias e pilhas para utilizacao da assessoria de comunicacao da prpr;270.00;40.00;230.50;17.14;2018;
13;servico de confeccao de placa de homenagem;270.00;40.00;230.50;17.14;2016;
14;servico de instalacao de trilho corte e instalacao de laminas em duas persianas mudanca;450.00;69.98;384.90;16.91;2020;prrn
10;lixa para massa gr100 rolo 23cm antigota lixa para massa gr220 lamina para serra em aco joelho em pvc 25mm luva em pvc 25mm adesivo contato 28kg adesivo pvc 75g incolor lubrificante spray 180g silicone bucha nylon 8mm e pistola em aco com tubo de silicone material utilizado para pintura de salas administrativas correcao de vazamento no cano da guarita lubrificante para portas e pistola para aplicacao de selante nas juntas do pavimento g2 do edificiosede da prr 5 regiao;212.39;34.55;181.78;16.84;2016;
17;manutencao do nonabreak do sistema de cftv o qual continuou a apresentar problemas de funcionamento mesmo apos a substituicao das baterias requerendo manutencao emergencial completa;485.00;90.00;415.15;16.83;2017;
10;lixa rolo suvinil piso e trinchas;212.37;34.55;181.78;16.83;2016;
11;reforcos para instalacao de anteparos acrilicos mesas servidores;210.00;33.80;180.00;16.67;2021;prsc
5;itens em falta ou prestes a acabar necessarios para o atendimento odontologico;399.60;75.55;343.00;16.50;2018;
19;p substituicao de pecas queimadas na prsc;359.25;71.00;308.73;16.37;2019;prsc
16;2 duas caixas de descarga acoplada material utilizado para substituicao das caixas de descarga danificadas na nova sala da divisao de seguranca organica e transporte  disegot e do gabinete 1003 do edificiosede da prr 5 regiao;384.00;66.02;330.00;16.36;2016;
8;limpeza de dois sofas;288.00;50.00;248.54;15.87;2020;prse
13;readequar sinalizacao devido a chegada de novos procuradores regionais;266.68;40.00;230.50;15.70;2021;prr3 regiao
13;readequar sinalizacao devido a chegada de novos procuradores;266.68;40.00;230.50;15.70;2021;prr3 regiao
18;material de manutencao predial para uso na prpb;264.50;48.00;228.78;15.62;2021;prpb
17;servico de revisao ajustes e troca da resistencia da cafeteira eletrica;480.00;90.00;415.15;15.62;2016;
17;servico manutencao na central de alarme enderecavel combate a incendio;480.00;90.00;415.15;15.62;2021;prba
10;aquisicao de vinil magnetico para a sinalizacao do acervo da biblioteca pois nao havia o material no almoxarifado;210.00;34.55;181.78;15.52;2018;
4;necessidade de aquisicao  de  materiais  odontologicos cujo  valor  total  e  baixo  e  portanto  nao  desperta  o  interesse  das dentais    empresas  especializadas  na  comercializacao  desses  materiais    a participarem   de   processos   licitatorios   nem   mesmo   de   apresentarem orcamentos a prr1no primeiro trimestre de 2021 a pgr tentou realizar umprocesso de registro de precos em ata para a compra desses materiais entreoutros que restou deserto;410.00;67.26;355.00;15.49;2021;prr1 regiao
9;obturador para o vaso sanitario e refil acqua libel para o frigobar para atender as necessidades neste orgao;236.00;42.00;204.85;15.21;2017;
17;considerando que a procuradoria nao conta com rede eletrica estabilizada;478.00;90.00;415.15;15.14;2018;
2;protecao contra a covid19 na prrs;439.56;93.80;381.85;15.11;2020;prrs
1;compra de moldura e vidro para aplicacao em mapa do estado de santa catarina a pedido do membro para fixacao no gabinete;154.00;11.60;134.35;14.63;2019;prsc
12;compra de saco de lixo 200 lt pacote com 100 unidades  01 unidade;212.60;31.00;185.55;14.58;2016;
2;alcool gel para higienizacao dos publicos internos e externos;437.40;93.80;381.85;14.55;2021;prrj
18;material para manutencao predial;261.76;48.00;228.78;14.42;2019;prr5 regiao
1;material necessario ao bom funcionamento do orgao;153.60;11.60;134.35;14.33;2017;
8;aquisicao de areia e cimento para realizacao de obra na calcada da rua debret;283.80;50.00;248.54;14.18;2016;
9;desempenador aco inox espatulas em aco inox 60m e 100m argamassa 25kg massa corrida pva 18l tubo pvc esgoto 50mm capa esgoto 100 joelho esgoto 90 reducao esgoto excentrica 100x50 t esgoto curto 50x50 material utilizado na sala de reuniao do 11 andar e no sistema de esgoto da cobertura do edificiosede da prr 5 regiao;233.80;42.00;204.85;14.13;2016;
5;aquisicao de espelhos convexos para instalacao no pavimento garagem visando a prevencao de acidentesem razao do baixo custo dos mesmos e da urgencia no tratamento da demanda foi autorizada sua compra via suprimento de fundos;389.36;75.55;343.00;13.52;2019;prse
7;torneira clinica para atender ao gabinete odontologico;332.00;80.00;292.50;13.50;2019;prrj
19;necessidade de reparo no sistema de porteiro eletronico da unidade vez que a barra dentada e roldana estavam desgastadas pelo tempo e uso causando constantes interrupcoes no funcionamento do portao;350.00;71.00;308.73;13.37;2018;
19;garrafas termicas para reposicao haja vista que algumas ja estavam danificadas pelo tempo e uso;349.60;71.00;308.73;13.24;2018;
12;adubo 082020 sacos com 50 kg  03 unidades;210.00;31.00;185.55;13.18;2016;
12;compra de pendrive 16 gb  06 unidades;210.00;31.00;185.55;13.18;2016;
12;bombona 20 litros  6 unidades;210.00;31.00;185.55;13.18;2016;
12;luva procedimento supermax ext peq com 100;210.00;31.00;185.55;13.18;2016;
18;realizacao de varias benfeitorias na procuradoria;258.80;48.00;228.78;13.12;2018;
16;lampadas  led  bulbo  item  necessario  para  substituicao  de  lampadasqueimadas nos corredores dos pavimentos terreo e primeiro andar sem  considerar  possivelarmazenamento    de  sobra  para  estoque a  situacao  dos  ambientes  atualmente  devido  aqueima  sem  reposicao compromete  a  seguranca  e  a  iluminacao  minima  necessaria  paraviabilizar  o  transito  de  pessoas  no  localjogo de alizar necessario para se cobrir a fresta que se formou entre as duasfolhas apos a instalacao da porta camarao no banheiro pne construido na sala 217 o alisarfara  o  acabamento  que  cobrira  a  fresta  necessario  para  se  garantir  a  privacidade  do usuario do banheiro;372.72;66.02;330.00;12.95;2020;prdf
7;compra emergencial de oxigenio medicinal recarga de 03 cilindros m3;330.00;80.00;292.50;12.82;2021;pgr
13;copia de chaves e troca de segredo de cadeados em razao do novo contrato de vigilancia;260.00;40.00;230.50;12.80;2019;pres
13;compra de 02cabos hubs usb 30 para serem utilizados nos diversos eventos organizados pela prr4 e esmpu;259.80;40.00;230.50;12.71;2019;prr4 regiao
4;para substituicao de termometro estragado;400.00;67.26;355.00;12.68;2021;prr4 regiao
3;para dar maior rigidez aos mastros das bandeiras que envergam com ventos fortes;450.00;74.90;399.45;12.65;2020;prr4 regiao
3;necessidade da secao de seguranca organica e transporte bem como da brigada de incendio em aprimorar os hidrantes da prms com esguichos regulaveis ante a constatacao em vistoria de ausencia de alguns esguichos nas caixas dos hidrantes da prms;450.00;74.90;399.45;12.65;2019;prms
2;tratase de aquisicao de material para adequar a procuradoria da republica em itajai a medidas de combate ao covid 19;430.00;93.80;381.85;12.61;2020;prsc
1;material para homenagem as servidoras pelo dia das maes;151.20;11.60;134.35;12.54;2017;
3;compras realizadas para atender ao treinamento da area fim  curso de ciberseguranca para membros do mpf de todo o brasil;449.26;74.90;399.45;12.47;2019;prmg
1;materiais que nao constam no almoxarifado  atender a demanda administrativa;150.98;11.60;134.35;12.38;2019;prrj
9;aquisicao de kit de reparos para caixa acoplada para bwc da prpr;230.00;42.00;204.85;12.28;2019;prpr
9;substituicao de tampa interna de bebedouro com termostato avariado;230.00;42.00;204.85;12.28;2018;
9;justificase a necessidade da prestacao de servicos de encanador para desentupir vaso sanitario da assessoria de gabinete bem como regulagem de valvula de hidra;230.00;42.00;204.85;12.28;2019;prpr
4;suprimento para atender despesas com material de consumo;397.77;67.26;355.00;12.05;2019;prsp
17;aquisicao de hd em carater emergencial para instalacao no storage da prm;465.00;90.00;415.15;12.01;2019;pres
17;materiais eletricos para manutencao da recepcao do cidadao;465.00;90.00;415.15;12.01;2019;prrr
15;manutencao  no  portao  da  garagem  da  prm  ribeirao  preto  que  saiu  fora  do  eixo  e danificou o cabo de aco sendo necessario o servico de um profissional de serralheria para sanar o problemaa  manutencao  do  portao  e  urgente  e  envolve  questoes  de  seguranca  devido  a  grande dificuldade de fechar o portao;300.00;63.63;268.50;11.73;2021;prsp
15;reparo e manutencao no portao da garagem;300.00;63.63;268.50;11.73;2020;prrj
15;conserto e manutecao do portao da garagem da prm niteroi;300.00;63.63;268.50;11.73;2021;prrj
15;conserto e manutencao do porta principal de acesso da prm niteroi;300.00;63.63;268.50;11.73;2021;prrj
15;reparo e manutencao no portao da recepcao;300.00;63.63;268.50;11.73;2020;prrj
15;servico de manutencao de porta de vidro temperado da recepcao dos servidores;300.00;63.63;268.50;11.73;2018;
15;necessidade urgente de substituicao dos puxadores das portas de vidro da entrada da rua do rosario;300.00;63.63;268.50;11.73;2019;pres
1;material para uso em encontros e reuniao com procuradores;150.00;11.60;134.35;11.65;2018;
1;atendimento a solicitacao da assessoria de comunicacao desta prr4 regiao;150.00;11.60;134.35;11.65;2019;prr4 regiao
1;servico de munck para troca das bandeiras no predio do ministerio publico federal;150.00;11.60;134.35;11.65;2016;
1;troca das bandeiras;150.00;11.60;134.35;11.65;2017;
12;adaptador eletrico 10a plug tripolar 30 unidades;207.00;31.00;185.55;11.56;2016;
4;aquisicao de pequena monta;396.00;67.26;355.00;11.55;2018;
5;atender solicitacao da disot;382.00;75.55;343.00;11.37;2021;prpr
5;considerando a necessidade de obtencao rapida do material assim como a dificuldade que estavamos tendo em comprar atraves de dispensa de licitacao pois as empresas estavam solicitando o pagamento em dinheiro ou cartao nao aceitando dessa forma o pagamento posterior atraves de empenho;381.91;75.55;343.00;11.34;2020;prrj
10;necessidade de instalacao urgente de dispensers para alcool gel;202.30;34.55;181.78;11.29;2020;prr4 regiao
11;canaleta ctampa 20 x 10 x 2000 auto adesiva na 50 unidades;200.00;33.80;180.00;11.11;2017;
6;conforme historico das pendencias contratuais da contratada riomix relatadas inicialmente na comunicacao interna n 902019 prmcpqsp000138112019 especialmente a nao entrega de material de limpeza e higienizacao no mes de novembro encontrase esta prm em estado de total falta de produtos para a continuidade adequadado contrato n 502017outrossim a contratada nao entregou a remessa de material do mes de dezembro intensificando nossa necessidade de compra emergencial dosprincipais produtos de limpeza por pelo menos mais uma semana no aguardo da contratacao do segundo colocado no certame;440.00;82.80;396.03;11.10;2019;prsp
1;lente para ascom;149.00;11.60;134.35;10.90;2019;prr5 regiao
9;bacia sanitaria;227.00;42.00;204.85;10.81;2016;
17;substituicao de 01 aparelho de ar condicionado e manutencao de outro aparelho imprescindivel para evitar superaquecimento equipamentos de informatica na sala;460.00;90.00;415.15;10.80;2019;prrs
17;servico emergencial de manutencao nas instalacoes eletricas da prmspa com utilizacao de material e revisao de toda a rede eletrica realizada em dia nao util  01112019;460.00;90.00;415.15;10.80;2019;prrj
1;aquisicao de rodas giratorias para carrinho de transporte de carga desta prrj;148.80;11.60;134.35;10.76;2018;
14;demanda do gabinete do procurador chefe por chapas de cortica para utilizacao no mural do hall da recepcao do gabinete do procuradorchefe;426.24;69.98;384.90;10.74;2019;prms
7;tratase de aquisicao de materias e ferrementas para o conserto da tubulacao das duas bombas dagua da procuradoria da republica em itajai;323.68;80.00;292.50;10.66;2021;prsc
4;demanda de pequena monta;392.00;67.26;355.00;10.42;2018;
3;o aparelho de ar condicionado da sala de equipamentos da prmpfundo apresentou problemas e precisou ser substituido com urgencia pois necessita ficar ligado dia e noite;440.00;74.90;399.45;10.15;2019;prrs
10;aquisicao de moldura;200.00;34.55;181.78;10.02;2019;prr4 regiao
10;08 metros quadrados de vidro laminado 4x4 bronze;200.00;34.55;181.78;10.02;2016;
10;lona para ser utilizada para servico de pintura cobrir os imobiliarios;200.00;34.55;181.78;10.02;2017;
10;compra de lona plastica preta 4 x 100 para servico de pintura  02 unidades;200.00;34.55;181.78;10.02;2016;
10;aquisicao de cordao de bolinha base para cortina de lamina vertical para atender a prrj em razao de nao possuirmos em nosso almoxarifado;200.00;34.55;181.78;10.02;2019;prrj
10;suporte optico cd 100un print plus suporte optico c 052x61 00br sh 100 dmpr;200.00;34.55;181.78;10.02;2016;
5;acucar itamarati pacote 2kg cristal;377.30;75.55;343.00;10.00;2016;
12;envelope saco 31 x 41 na 240 unidades;204.00;31.00;185.55;9.94;2017;
16;aquisicao de materiais hidraulicos;362.75;66.02;330.00;9.92;2018;
5;acucar itamarati pacote 2kg cristal;377.00;75.55;343.00;9.91;2016;
16;material para reparos e manutencao da prm monteiro;362.50;66.02;330.00;9.85;2021;prpb
2;aquisicao de alcool em gel;419.40;93.80;381.85;9.83;2021;prrj
2;aquisicao de alcool em gel 70;419.40;93.80;381.85;9.83;2021;prrj
5;nao ha contrato vigente para o objeto;376.00;75.55;343.00;9.62;2018;
17;material para manutencao de cameras;455.00;90.00;415.15;9.60;2018;
7;garrafoes de agua para pre;320.00;80.00;292.50;9.40;2019;prba
9;aquisicao de materiais hidraulicos para troca do registro do vaso sanitario no edificio patriarca;224.00;42.00;204.85;9.35;2017;
9;aquisicao de materiais hidraulicos para troca do registro do vaso sanitario no edificio patriarca;224.00;42.00;204.85;9.35;2017;
17;a prm jundiai mudou de sede e precisava reparar a cerca eletrica da antiga sede para regularizacao das pendencias daquele contrato de aluguel;453.53;90.00;415.15;9.24;2021;prsp
18;materiais para uso manutencao predial;249.90;48.00;228.78;9.23;2018;
0;oleo hidraulico para o elevador de veiculos;460.00;90.00;421.55;9.12;2021;prrj
16;aquisicao urgente de materiais necessarios a impermeabilizacao das janelas do anexo 2;360.00;66.02;330.00;9.09;2019;pgr
16;para execucao de servicos de pintura;360.00;66.02;330.00;9.09;2021;prrj
12;aquisicao de espuma para substituicao nos aparelhos de ar condicionado da prrj;202.40;31.00;185.55;9.08;2019;prrj
16;garrafa termica para atender a copa do 6 pavimento em razao das existentes nao estarem mantendo o cafe aquecido e tb em razao das inumeras reunioes que ocorrem no andar;359.60;66.02;330.00;8.97;2018;
15;"lencol de borracha para forrar o piso onde sera instalado 2 aparelhos de ar condicionado
desengripante para uso nas portas fechaduras e afins";291.80;63.63;268.50;8.68;2018;
13;servicos graficos especificos para confeccao de placas de sinalizacao;250.00;40.00;230.50;8.46;2019;prrj
13;130 copias a3 digital color 49 copias a3 digital pb;250.00;40.00;230.50;8.46;2016;
3;compras realizadas para atender ao treinamento da area fim  curso de ciberseguranca para membros do mpf de todo o brasil;433.06;74.90;399.45;8.41;2019;prmg
17;conserto de ar split do rack de informatica;450.00;90.00;415.15;8.39;2021;prrj
17;servicos tecnicos de ativacao na central telefonica e configuracao do pabx rotas feixes categorias e ramais ddr;450.00;90.00;415.15;8.39;2016;
17;manutencao corretiva de motor gerador;450.00;90.00;415.15;8.39;2021;prrr
13;aquisicao de lonas plasticas tendo em vista a necessidade de protecao de bens desta prmipatinga;249.80;40.00;230.50;8.37;2021;prmg
3;servico de confeccao de adesivos para a campanha de descarte de lixo;432.00;74.90;399.45;8.15;2019;prrj
18;aquisicao de ferramentas indispensaveis a manutencao predial da prmipatinga;247.20;48.00;228.78;8.05;2021;prmg
1;passagem do servidor cesar augusto de ida ao municipio de bagre no barco bom jesus;145.00;11.60;134.35;7.93;2018;
1;passagem do servidor cesar augusto de volta em 21092018 do municipio de bagre para belempa no barco bom jesus;145.00;11.60;134.35;7.93;2018;
1;passagem do servidor francisco silveira de volta em 21092018 do municipio de bagre para belempa no barco bom jesus;145.00;11.60;134.35;7.93;2018;
1;passagem do servidor francisco silveira de ida para o municipio de bagre no barco bom jesus;145.00;11.60;134.35;7.93;2018;
17;cabos hdmi para uso no auditorio e na sala de reunioes do 5 andar;448.00;90.00;415.15;7.91;2018;
19;aquisicao emergencial de lampadas tubulares de led para as salas e corredor da prmmacae;332.88;71.00;308.73;7.82;2021;prrj
12;compra de laminas de pvc para persianas  09 unidades;200.00;31.00;185.55;7.79;2016;
5;itens em falta ou prestes a acabar necessarios para o atendimento odontologico;369.30;75.55;343.00;7.67;2019;prrj
15;cadeados para fechar portas de reservatorios;289.00;63.63;268.50;7.64;2019;prrs
16;para atender ao predio da prrj;355.00;66.02;330.00;7.58;2018;
18;reposicao e troca de material predial;246.05;48.00;228.78;7.55;2018;
16;reparo nos banheiros masculinos da prr1 material inexistente no almoxarifado;354.41;66.02;330.00;7.40;2021;prr1 regiao
14;no risk tapete proteor para piso;413.00;69.98;384.90;7.30;2016;
12;rejunte flex 10;199.00;31.00;185.55;7.25;2016;
12;aquisicao de tomada de sobrestar para uso na prm;199.00;31.00;185.55;7.25;2017;
10;fechaduras ganchos e batentes de silicone;194.80;34.55;181.78;7.16;2016;
18;carregador de pilhas para uso em evento no auditorio;245.10;48.00;228.78;7.14;2018;
17;aquisicao de materiais necessarios para conclusao da instalacao dos aparelhos de ar condicionado do 11 pavimento;444.00;90.00;415.15;6.95;2018;
4;o presente servico tem carater de urgencia e nao foi possivel haver planejamento pois tratase de lampadas queimadas;379.00;67.26;355.00;6.76;2019;prrs
12;aquisicao de regua de tomada de 12 posicoes para a ci pois nao havia o item no almoxarifado;198.00;31.00;185.55;6.71;2018;
8;aquisicao de caixa de arquivo morto;265.00;50.00;248.54;6.62;2020;prrj
15;aquisicao de porta da assessoria do gabinete para instalacao de fechadura biometrica;286.00;63.63;268.50;6.52;2019;prpb
16;aquisicao de sensor de barreira para ed da sede da prac;350.00;66.02;330.00;6.06;2018;
16;servico de reparo em bomba centrifuga da prm;350.00;66.02;330.00;6.06;2018;
16;servicos de conserto de refrigerador electrolux dfn42;350.00;66.02;330.00;6.06;2021;prrj
16;manutencao corretiva de janela de dois gabinetesa prm marilia nao dispoe de contrato de manutencao predial;350.00;66.02;330.00;6.06;2019;prsp
15;necessidade de pilhas aa para fechadura biometrica  nao possui estoque;284.42;63.63;268.50;5.93;2019;prba
17;aquisicao de 01 valvula de retencao vertical dn 4 necessaria par d instalacao do sistema de bombeamento da rede de aguas pluviais da pgr;439.00;90.00;415.15;5.74;2021;pgr
1;p adequacao da galeria de visitas de procuradores gerais da republica;142.00;11.60;134.35;5.69;2019;prsc
4;despesa de pequeno vulto nao passivel de planejamento;375.00;67.26;355.00;5.63;2018;
4;despesas eventual de pequena monta sem cobertura contratual;375.00;67.26;355.00;5.63;2017;
14;p pintura de sala na prsc;405.44;69.98;384.90;5.34;2019;prsc
16;aquisicao de 01 valvula solenoide necessaria ao sistema de irrigacao da pgr devido a falhas no sistema;347.45;66.02;330.00;5.29;2019;pgr
3;locacao de 04 pecas escoramento com 46 m durante 300 dias;420.00;74.90;399.45;5.14;2016;
12;aquisicao de envelope saco 24x34 para atender a demanda deste orgao;195.00;31.00;185.55;5.09;2017;
13;compra de borrachas e carimbos;242.00;40.00;230.50;4.99;2019;prmt
6;o servidor jodeilson estava de licenca;415.58;82.80;396.03;4.94;2020;prr5 regiao
18;foi efetuada a compra de button para vigia bastao;240.00;48.00;228.78;4.91;2019;prrs
17;campanha de economia de energia;435.40;90.00;415.15;4.88;2021;prr4 regiao
12;kit para instalacao hidraulica de dois bebedouros cano cola curvas adaptadores sifao fiacao eletrica caixa de tomada etc instalacao sera feita pelo zelador trena de 5 metros com trava uso para o zelador;194.50;31.00;185.55;4.82;2020;prmg
2;material solicitado devido a pandemia por covid19;400.00;93.80;381.85;4.75;2020;prr3 regiao
12;mini sanduiche leite integral tareco e bolinho de goma;194.36;31.00;185.55;4.75;2016;
0;abastecimento do veiculo oficial placa iwm0841 s10por necessidade do servico;440.73;90.00;421.55;4.55;2021;prr4 regiao
15;extensao do vidro da recepcao e da sala de atendimento para prevencao ao contato com publico externo do covid19;280.50;63.63;268.50;4.47;2020;prmg
13;foi necessaria a compra de identificador de chaves;240.80;40.00;230.50;4.47;2019;prrs
15;o em vista a extincao da prestacao do servico de vigilanciaarmada  24  horas  e  novas  orientacoes  da  procuradoria  da  republica  no  estado  do  rs  prrs determinando a instalacao de servicos de monitoramento e sistema de alarme para opredio  sede  da  prmsanta  mariasantiagors  foi  necessario  confeccionar  copias  docontrole remoto que da acesso a garagem do predio essas copias do controle remoto seraoentregues  somente  aos  servidores  com  acesso  autorizado  pela  coordenacao  da  prm  aopredio sede da prmsanta mariasantiagors em caso de necessidade;280.00;63.63;268.50;4.28;2019;prrs
15;por motivos de seguranca para evitar acidentes houve a necessidade de instalar espelho convexo na entrada do estacionamento para visualizar os veiculos que trafegarem na direcao contraria;280.00;63.63;268.50;4.28;2018;
1;cartao sd sandisk 64gb material solicitado pela assessoria de comunicacao  asscom da prr 5 regiao para entrevista realizada na procuradoriageral da republica  pgr;140.00;11.60;134.35;4.21;2016;
1;vistoria tecnica e programacao de pabx servico solicitado pelo servidor frederico antonio simoes de souza durante sua visita para instalacao de novo link de telefonia;140.00;11.60;134.35;4.21;2016;
1;compra de passagem para o servidor volnei martins figueiredo no trecho de brevesbelem em virtude de retorno de diligencia realizada na zona rural do municipio de anajas no para;140.00;11.60;134.35;4.21;2020;prpa
1;vistoria tecnica e programacao de pabx;140.00;11.60;134.35;4.21;2016;
1;compra de passagem para o servidor savio cosme vasconcelos barros no trecho de brevesbelem em virtude de retorno de diligencia realizada na zona rural do municipio de anajas no para;140.00;11.60;134.35;4.21;2020;prpa
1;aq cartao micro sd 64 gb ultra;140.00;11.60;134.35;4.21;2016;
1;compra de passagem para o servidor cesar augusto souza no trecho de brevesbelem em virtude de retorno de diligencia realizada na zona rural do municipio de anajas no para;140.00;11.60;134.35;4.21;2020;prpa
1;compra de passagem para o servidor elias araujo cunha no trecho de brevesbelem em virtude de retorno de diligencia realizada na zona rural do municipio de anajas no para;140.00;11.60;134.35;4.21;2020;prpa
6;atender a pequenas demandas de servicos em beneficio da prpi;412.50;82.80;396.03;4.16;2019;prpi
13;necessidade de trocas de fechaduras  e confeccao de chaves para gabinete de procurador banheiros e armarios da prm angra dos reis visando maior seguranca nas dependencias da prm;240.00;40.00;230.50;4.12;2019;prrj
13;itens que a ctic necessita;240.00;40.00;230.50;4.12;2020;prr1 regiao
13;aquisicao de 20 controles remotos sem codificacao  para uso em portoes e cancelas;240.00;40.00;230.50;4.12;2018;
13;aquisicao de material de consumo para uso na prm blumenau;239.70;40.00;230.50;3.99;2021;prsc
14;molduras p quadro calendario de atividades;400.00;69.98;384.90;3.92;2019;prr4 regiao
14;pedido de cabo pra destravamento dos radios de seguranca da prrn;400.00;69.98;384.90;3.92;2021;prrn
15;aquisicao de placa para motor do portao de acesso a prma;278.90;63.63;268.50;3.87;2018;
3;autorizado pelo coordenador de administracao com anuencia do secretario estadual;414.50;74.90;399.45;3.77;2021;prro
9;aquisicao urgente de 01 mangueira flexivel para a ducha instalada no materninho para banhos das criancas;212.32;42.00;204.85;3.65;2019;pgr
17;manutencao de ar condicionado emergencial da prmgvs;430.00;90.00;415.15;3.58;2019;prmg
7;compra de materiais para reparo na prm picos;302.80;80.00;292.50;3.52;2017;
9;dobradica superior 3 e inferior 2;211.58;42.00;204.85;3.29;2016;
5;"66 pacotes de areia lavada fina 20 kg  cartefix
07 pacotes de filito para argamassa  17 kg aditivado
02 ferros para construcao 042 mm";354.11;75.55;343.00;3.24;2016;
16;aquisicao de duas torneiras pressmatic compact de mesa para uso no banheiro masculino do 8 andar do predio sede da prpr;340.00;66.02;330.00;3.03;2017;
